corpusid,arxiv_id,title,year,venue,citationcount,referencecount,influentialcitationcount,content_references,equations,figures,font,pages,paragraphs,sections,subsections,subsubsections,tables,words
220597151,2008.00104,Optimizing Long-term Social Welfare in Recommender Systems: A Constrained Matching Approach,2020,International Conference on Machine Learning,51,52,3,53,7,16,NimbusRomNo9L,23,6,7,10,0,4,15075
253098635,2210.13132,PAC-Bayesian Offline Contextual Bandits With Guarantees,2022,International Conference on Machine Learning,10,54,1,85,130,11,NimbusRomNo9L,23,8,10,17,3,2,13621
250088962,2206.13687,POEM: Out-of-Distribution Detection with Posterior Sampling,2022,International Conference on Machine Learning,65,59,6,154,40,15,NimbusRomNo9L,16,16,16,6,0,12,10622
246652190,2202.03599,Penalizing Gradient Norm for Efficiently Improving Generalization in Deep Learning,2022,International Conference on Machine Learning,63,33,8,48,40,9,NimbusRomNo9L,11,5,7,5,0,8,6656
232417884,2103.15813,PixelTransformer: Sample Conditioned Signal Generation,2021,International Conference on Machine Learning,10,44,0,0,0,0,NimbusRomNo9L,10,0,0,0,0,0,6759
234339280,2105.04371,Poolingformer: Long Document Modeling with Pooling Attention,2021,International Conference on Machine Learning,79,44,10,101,24,7,NimbusRomNo9L,10,0,6,6,7,14,7186
256389936,2206.08594,Principled Acceleration of Iterative Numerical Methods Using Machine Learning,2022,International Conference on Machine Learning,5,51,1,43,74,11,CMR10,29,9,8,9,4,6,11729
211197681,2002.09463,Privately Learning Markov Random Fields,2020,International Conference on Machine Learning,21,80,0,0,0,0,CMR10,29,0,1,0,0,0,14371
253383841,2211.03761,Proper losses for discrete generative models,2022,International Conference on Machine Learning,1,24,0,42,48,0,NimbusRomNo9L,20,4,16,24,0,0,10798
231802306,2102.02400,Provably End-to-end Label-Noise Learning without Anchor Points,2021,International Conference on Machine Learning,84,56,12,50,48,37,NimbusRomNo9L,15,0,10,4,0,6,9619
220525904,2007.07878,Quantifying and Reducing Bias in Maximum Likelihood Estimation of Structured Anomalies,2020,International Conference on Machine Learning,3,80,0,99,234,26,LinLibertineT,38,0,14,14,0,0,18829
258967765,2208.06448,RLang: A Declarative Language for Describing Partial World Knowledge to Reinforcement Learning Agents,2022,International Conference on Machine Learning,0,42,0,94,20,31,NimbusRomNo9L,18,30,9,12,0,4,11807
248810859,2205.07536,Reachability Constrained Reinforcement Learning,2022,International Conference on Machine Learning,31,48,4,95,128,37,NimbusRomNo9L,20,0,12,16,4,6,13039
249953660,2206.11775,Regression with Label Permutation in Generalized Linear Model,2022,International Conference on Machine Learning,5,58,0,66,404,18,SFRM1000,47,1,14,24,10,6,18914
211818320,2003.01690,Reliable evaluation of adversarial robustness with an ensemble of diverse parameter-free attacks,2020,International Conference on Machine Learning,1307,57,329,438,23,23,NimbusRomNo9L,20,0,11,10,0,32,14533
239049915,2104.08690,Rethinking Image-Scaling Attacks: The Interplay Between Vulnerabilities in Machine Learning Systems,2021,International Conference on Machine Learning,9,55,0,0,0,0,NimbusRomNo9L,20,0,0,0,0,0,13459
245424850,2112.12376,Revisiting and Advancing Fast Adversarial Training Through The Lens of Bi-Level Optimization,2021,International Conference on Machine Learning,57,58,5,120,38,7,NimbusRomNo9L,20,23,7,2,0,10,11846
249890184,2206.08994,Robust Group Synchronization via Quadratic Programming,2022,International Conference on Machine Learning,6,30,2,64,49,21,NimbusRomNo9L,11,0,4,14,0,2,7950
221089298,2011.06169,Robust and Stable Black Box Explanations,2020,International Conference on Machine Learning,69,48,3,56,54,5,NimbusRomNo9L,14,0,6,9,0,4,9344
249210071,2205.15875,SOM-CPC: Unsupervised Contrastive Learning with Self-Organizing Maps for Structured Representations of High-Rate Time Series,2022,International Conference on Machine Learning,3,39,1,41,77,9,NimbusRomNo9L,21,0,1,5,7,12,14513
246823870,2202.06385,Sample-Efficient Reinforcement Learning with loglog(T) Switching Cost,2022,International Conference on Machine Learning,21,45,1,2,0,0,CMR10,44,0,7,0,0,0,19810
235417073,2106.05992,Scalable Variational Gaussian Processes via Harmonic Kernel Decomposition,2021,International Conference on Machine Learning,5,47,1,18,36,3,NimbusRomNo9L,21,1,4,5,0,0,11675
220364143,2007.02418,Selective Dyna-style Planning Under Limited Model Capacity,2020,International Conference on Machine Learning,22,48,2,55,8,60,NimbusRomNo9L,17,0,12,9,6,8,9440
212634075,2003.03461,Semi-Supervised StyleGAN for Disentanglement Learning,2020,International Conference on Machine Learning,67,36,7,124,24,64,NimbusRomNo9L,21,13,12,20,0,8,9518
246823533,2202.05567,Shuffle Private Linear Contextual Bandits,2022,International Conference on Machine Learning,15,59,0,84,124,4,NimbusRomNo9L,32,1,11,16,0,0,15572
253080445,2210.11542,Sketching Meets Differential Privacy: Fast Algorithm for Dynamic Kronecker Projection Maintenance,2022,International Conference on Machine Learning,16,111,0,0,0,0,CMR10,57,0,0,0,0,0,23547
235826140,2106.06969,SoundDet: Polyphonic Moving Sound Event Detection and Localization from Raw Waveform,2021,International Conference on Machine Learning,11,29,1,49,12,18,NimbusRomNo9L,11,0,6,11,0,8,7686
245837365,2201.03064,Stability Based Generalization Bounds for Exponential Family Langevin Dynamics,2022,International Conference on Machine Learning,6,79,0,0,0,0,URWPalladioL,50,0,10,0,0,0,18439
250340636,2208.01573,Stochastic Deep Networks with Linear Competing Units for Model-Agnostic Meta-Learning,2022,International Conference on Machine Learning,6,45,0,116,32,17,NimbusRomNo9L,12,0,10,10,7,14,7417
247940027,2204.00706,Strategies for Safe Multi-Armed Bandits with Logarithmic Regret and Risk,2022,International Conference on Machine Learning,5,25,0,80,138,46,SFRM1000,32,0,12,11,1,0,16634
235826471,2107.08577,Structured World Belief for Reinforcement Learning in POMDP,2021,International Conference on Machine Learning,21,55,1,84,104,78,NimbusRomNo9L,28,0,13,18,15,10,14474
220514773,2007.06631,T-Basis: a Compact Representation for Neural Networks,2020,International Conference on Machine Learning,22,77,0,72,46,25,NimbusRomNo9L,13,12,7,10,0,4,9710
244920903,2112.03753,Tell me why! Explanations support learning relational and causal structure,2021,International Conference on Machine Learning,32,87,0,174,1,27,NimbusRomNo9L,23,0,6,5,0,0,14064
247318543,2203.04466,The Combinatorial Brain Surgeon: Pruning Weights That Cancel One Another in Neural Networks,2022,International Conference on Machine Learning,27,109,2,88,27,5,NimbusRomNo9L,16,2,13,0,0,2,11163
235358107,2106.03352,The Power of Exploiter: Provable Multi-Agent RL in Large State Spaces,2021,International Conference on Machine Learning,42,69,7,0,0,0,CMR10,38,0,0,0,0,0,17251
232146691,2103.04568,Three Operator Splitting with a Nonconvex Loss Function,2021,International Conference on Machine Learning,8,54,1,144,294,7,URWPalladioL,27,0,13,7,0,0,11740
235254049,2105.15134,Toward Understanding the Feature Learning Process of Self-supervised Contrastive Learning,2021,International Conference on Machine Learning,101,61,6,46,377,12,CMR10,67,16,11,20,0,0,28875
235623756,2106.13219,Towards Understanding and Mitigating Social Biases in Language Models,2021,International Conference on Machine Learning,240,57,8,135,28,27,NimbusRomNo9L,22,0,13,21,0,24,14601
229363322,2012.12877,Training data-efficient image transformers & distillation through attention,2020,International Conference on Machine Learning,4667,66,806,117,9,10,URWPalladioL,22,23,7,5,0,22,8399
232092231,2103.01312,UCB Momentum Q-learning: Correcting the bias without forgetting,2021,International Conference on Machine Learning,33,26,6,0,0,0,NimbusRomNo9L,31,0,1,0,0,0,16045
249848242,2206.08675,Understanding Robust Overfitting of Adversarial Training and Beyond,2022,International Conference on Machine Learning,33,42,4,0,0,0,NimbusRomNo9L,16,0,1,0,0,0,9651
211066384,2002.02912,Universal Equivariant Multilayer Perceptrons,2020,International Conference on Machine Learning,38,50,0,47,60,6,NimbusRomNo9L,11,2,6,10,1,4,8096
227208819,2011.13920,Unsupervised part representation by Flow Capsules,2020,International Conference on Machine Learning,32,46,2,0,0,0,NimbusRomNo9L,11,0,1,0,0,0,6572
232069095,2102.13643,Variance Reduction via Primal-Dual Accelerated Dual Averaging for Nonsmooth Convex Finite-Sums,2021,International Conference on Machine Learning,13,43,0,103,254,28,CMR10,33,9,10,0,0,4,16144
211817858,2003.01531,Voice Separation with an Unknown Number of Multiple Speakers,2020,International Conference on Machine Learning,156,55,27,91,16,15,NimbusRomNo9L,12,1,6,7,0,16,8185
247187969,2203.00176,When AUC meets DRO: Optimizing Partial AUC for Deep Learning with Non-Convex Convergence Guarantee,2022,International Conference on Machine Learning,18,44,2,76,220,47,NimbusRomNo9L,25,0,12,14,0,10,16074
227162474,2011.12491,World Model as a Graph: Learning Latent Landmarks for Planning,2020,International Conference on Machine Learning,57,53,5,61,18,30,NimbusRomNo9L,12,0,7,7,0,0,8022
249848303,2106.03076,A Convergence Theory for SVGD in the Population Limit under Talagrand's Inequality T1,2021,International Conference on Machine Learning,15,44,3,117,121,0,NimbusRomNo9L,14,1,9,12,3,0,7790
255186280,2212.13350,A Generalization of ViT/MLP-Mixer to Graphs,2022,International Conference on Machine Learning,36,96,6,317,26,22,NimbusRomNo9L,23,0,18,18,0,32,14113
249848085,2206.08499,A Parametric Class of Approximate Gradient Updates for Policy Optimization,2022,International Conference on Machine Learning,0,37,0,56,70,22,NimbusRomNo9L,18,0,12,13,0,4,10084
231979051,2102.09626,A Simple Unified Framework for High Dimensional Bandit Problems,2021,International Conference on Machine Learning,19,43,2,0,0,0,CMR10,44,0,0,0,0,0,18160
231854993,2010.04879,Accelerate CNNs from Three Dimensions: A Comprehensive Pruning Framework,2020,International Conference on Machine Learning,41,43,2,90,68,15,NimbusRomNo9L,11,20,7,9,4,10,8181
233289756,2104.07749,Actionable Models: Unsupervised Offline Reinforcement Learning of Robotic Skills,2021,International Conference on Machine Learning,125,51,14,0,0,0,NimbusRomNo9L,11,0,1,1,1,0,8370
255125421,2212.12567,Adapting to game trees in zero-sum imperfect information games,2022,International Conference on Machine Learning,4,67,0,0,0,0,NimbusRomNo9L,42,0,1,0,0,2,22623
246634804,2202.03077,Adversarial Attack and Defense for Non-Parametric Two-Sample Tests,2022,International Conference on Machine Learning,1,126,0,4,0,0,NimbusRomNo9L,27,0,0,0,0,0,17610
259095885,2206.12977,Adversarially Robust PAC Learnability of Real-Valued Functions,2022,International Conference on Machine Learning,1,72,0,114,240,0,SFRM1000,30,10,11,3,0,0,16955
244896472,2112.02045,An Analytical Update Rule for General Policy Optimization,2021,International Conference on Machine Learning,4,31,0,69,328,3,NimbusRomNo9L,21,0,10,12,0,0,11105
237353474,2108.12821,Analyzing and Mitigating Interference in Neural Architecture Search,2021,International Conference on Machine Learning,26,77,3,164,10,37,NimbusRomNo9L,17,18,10,11,0,12,11509
231924978,2102.07006,Asymmetric Heavy Tails and Implicit Bias in Gaussian Noise Injections,2021,International Conference on Machine Learning,14,69,1,119,271,49,NimbusRomNo9L,33,1,13,9,0,0,18928
211204706,2002.08822,Automatic Shortcut Removal for Self-Supervised Representation Learning,2020,International Conference on Machine Learning,64,43,3,0,0,0,NimbusRomNo9L,20,1,1,0,0,0,9867
219530761,2006.04064,Bayesian Graph Neural Networks with Adaptive Connection Sampling,2020,International Conference on Machine Learning,83,49,8,106,48,7,NimbusRomNo9L,15,0,9,10,6,6,9269
246485777,2202.01273,Beyond Images: Label Noise Transition Matrix Estimation for Tasks with Lower-Quality Features,2022,International Conference on Machine Learning,27,68,1,0,0,0,NimbusRomNo9L,21,0,0,0,0,0,13854
214611940,2003.09554,Black-box Methods for Restoring Monotonicity,2020,International Conference on Machine Learning,2,26,0,0,0,0,CMR10,15,0,0,0,0,0,9340
219966101,2006.11917,Breaking the Curse of Many Agents: Provable Mean Embedding Q-Iteration for Mean-Field Reinforcement Learning,2020,International Conference on Machine Learning,23,94,1,0,8,0,CMR10,31,0,0,0,0,0,14526
219966650,2006.12013,CLUB: A Contrastive Log-ratio Upper Bound of Mutual Information,2020,International Conference on Machine Learning,216,48,46,126,68,14,NimbusRomNo9L,14,0,12,7,0,6,8790
246442301,2202.00436,Causal Inference Principles for Reasoning about Commonsense Causality,2022,International Conference on Machine Learning,17,65,3,3,0,1,NimbusRomNo9L,22,0,0,0,0,0,16556
235422374,2106.06932,Characterizing the Gap Between Actor-Critic and Policy Gradient,2021,International Conference on Machine Learning,13,38,0,10,78,13,NimbusRomNo9L,21,0,13,4,4,4,11487
248827928,2206.09182,Coin Flipping Neural Networks,2022,International Conference on Machine Learning,2,46,0,0,0,0,NimbusRomNo9L,20,0,6,0,0,0,13099
235436412,2002.11743,Composing Normalizing Flows for Inverse Problems,2020,International Conference on Machine Learning,42,68,2,99,23,11,NimbusRomNo9L,16,0,11,19,0,6,9596
246863815,2202.07650,Conformal Prediction Sets with Limited False Positives,2022,International Conference on Machine Learning,20,60,3,3,0,0,NimbusRomNo9L,18,0,1,1,1,0,11725
245329451,2112.09161,Constraint-based graph network simulator,2021,International Conference on Machine Learning,18,56,2,49,0,3,NimbusRomNo9L,25,0,2,0,0,0,15219
249062742,2205.12693,Contrastive Learning with Boosted Memorization,2022,International Conference on Machine Learning,14,49,3,148,24,19,NimbusRomNo9L,11,1,6,9,0,10,8185
259982563,2209.15514,Cooperation in the Latent Space: The Benefits of Adding Mixture Components in Variational Autoencoders,2022,International Conference on Machine Learning,4,62,0,198,50,21,NimbusRomNo9L,16,0,12,11,5,20,9826
232105117,2103.02051,Cross-Gradient Aggregation for Decentralized Learning from Non-IID data,2021,International Conference on Machine Learning,39,44,5,105,194,38,NimbusRomNo9L,24,0,7,12,0,14,12522
256105787,2208.04187,DIVISION: Memory Efficient Training via Dual Activation Precision,2022,International Conference on Machine Learning,1,47,0,63,135,28,NimbusRomNo9L,22,6,24,21,0,20,14472
246634629,2202.02916,Dataset Condensation with Contrastive Signals,2022,International Conference on Machine Learning,51,37,6,1,0,0,NimbusRomNo9L,13,1,0,0,0,0,8245
246823128,2202.06539,Deduplicating Training Data Mitigates Privacy Risks in Language Models,2022,International Conference on Machine Learning,127,41,10,0,0,0,NimbusRomNo9L,11,0,0,0,0,0,6955
219179771,2006.01392,DeepCoDA: personalized interpretability for compositional health data,2020,International Conference on Machine Learning,11,42,2,49,20,21,NimbusRomNo9L,14,0,8,9,5,4,7760
248863377,2201.12323,Describing Differences between Text Distributions with Natural Language,2022,International Conference on Machine Learning,20,82,2,101,14,24,NimbusRomNo9L,18,0,15,4,0,6,11083
226227159,2011.00467,Differentially Private Bayesian Inference for Generalized Linear Models,2020,International Conference on Machine Learning,22,54,2,63,58,14,NimbusRomNo9L,17,0,7,10,2,0,10119
232046102,2102.12594,Directional Bias Amplification,2021,International Conference on Machine Learning,40,67,8,4,0,0,NimbusRomNo9L,16,0,8,0,0,0,10881
253370283,2211.02212,Distributed Linear Bandits under Communication Constraints,2022,International Conference on Machine Learning,5,66,0,27,13,0,SFRM1000,40,5,6,6,4,0,17531
211032079,2002.01751,Does the Markov Decision Process Fit the Data: Testing for the Markov Property in Sequential Decision Making,2020,International Conference on Machine Learning,26,41,0,76,234,15,NimbusRomNo9L,25,0,8,20,12,2,13648
231979049,2102.09844,E(n) Equivariant Graph Neural Networks,2021,International Conference on Machine Learning,626,41,125,0,0,0,NimbusRomNo9L,16,0,0,0,0,0,11304
220302031,2007.01003,Efficient Proximal Mapping of the 1-path-norm of Shallow Networks,2020,International Conference on Machine Learning,3,49,0,113,137,20,NimbusRomNo9L,28,5,14,7,0,0,15981
236469306,2107.13068,End-to-End Balancing for Causal Continuous Treatment-Effect Estimation,2021,International Conference on Machine Learning,11,48,1,100,46,15,NimbusRomNo9L,14,21,10,11,0,4,8219
250089195,2206.14069,Equivariant Priors for Compressed Sensing with Unknown Orientation,2022,International Conference on Machine Learning,2,39,0,0,0,0,NimbusRomNo9L,19,0,0,0,0,0,9602
220265828,2006.16958,Evaluating the Performance of Reinforcement Learning Algorithms,2020,International Conference on Machine Learning,37,68,3,86,6,15,NimbusRomNo9L,30,0,10,9,2,4,17501
222124917,2010.01062,Exploration in Approximate Hyper-State Space for Meta Reinforcement Learning,2020,International Conference on Machine Learning,32,50,3,152,16,52,NimbusRomNo9L,20,1,11,19,2,8,12892
252780559,2210.04635,FaDIn: Fast Discretized Inference for Hawkes Processes with General Parametric Kernels,2022,International Conference on Machine Learning,1,70,0,143,58,96,NimbusRomNo9L,23,4,7,14,1,2,12479
249847865,2206.08869,Fast Lossless Neural Compression with Integer-Only Discrete Flows,2022,International Conference on Machine Learning,7,57,0,49,44,10,NimbusRomNo9L,14,4,6,6,0,2,8920
174799838,2008.01296,Faster Stochastic Alternating Direction Method of Multipliers for Nonconvex Optimization,2020,International Conference on Machine Learning,28,41,4,60,412,12,NimbusRomNo9L,43,0,9,12,0,4,22379
216056725,2004.10342,Federated Learning with Only Positive Labels,2020,International Conference on Machine Learning,84,30,9,54,56,0,SFRM1095,15,0,7,6,0,8,7224
221954280,2007.04470,Finite mixture models do not reliably learn the number of components,2020,International Conference on Machine Learning,19,89,1,48,0,0,SFRM1000,25,0,1,0,0,0,11247
249097703,2205.13028,Formalizing Preferences Over Runtime Distributions,2022,International Conference on Machine Learning,4,54,0,56,148,9,NimbusRomNo9L,24,10,11,10,0,0,15489
247362627,2203.05481,Fully Adaptive Composition in Differential Privacy,2022,International Conference on Machine Learning,20,44,2,0,0,0,NimbusRomNo9L,23,0,0,0,0,0,13733
234482038,2002.03129,GLSearch: Maximum Common Subgraph Detection via Learning to Search,2020,International Conference on Machine Learning,22,64,1,214,12,179,NimbusRomNo9L,37,3,16,45,4,30,17702
235125944,2105.10475,Generalization Error Bound for Hyperbolic Ordinal Embedding,2021,International Conference on Machine Learning,8,45,0,121,274,0,NimbusRomNo9L,16,1,11,14,0,0,11555
246608231,2202.01889,Generalizing to New Physical Systems via Context-Informed Dynamics Model,2022,International Conference on Machine Learning,18,65,6,147,65,26,NimbusRomNo9L,19,20,14,19,4,2,13790
221139539,2008.06845,Global Convergence of Policy Gradient for Linear-Quadratic Mean-Field Control/Game in Continuous Time,2020,International Conference on Machine Learning,22,58,1,36,5,7,CMR10,28,0,11,7,0,0,9631
231925260,2102.06966,Graph Convolution for Semi-Supervised Classification: Improved Linear Separability and Out-of-Distribution Generalization,2021,International Conference on Machine Learning,59,48,10,32,174,61,CMR10,33,0,8,19,0,4,15452
220381192,2007.03328,Guided Exploration with Proximal Policy Optimization using a Single Demonstration,2020,International Conference on Machine Learning,19,44,0,89,22,24,NimbusRomNo9L,13,0,10,5,0,8,8114
234470059,2105.05806,High-Dimensional Experimental Design and Kernel Bandits,2021,International Conference on Machine Learning,48,31,8,56,316,7,CMR10,34,4,14,16,0,0,15775
215814449,2004.08013,How recurrent networks implement contextual processing in sentiment analysis,2020,International Conference on Machine Learning,22,72,2,61,36,54,NimbusRomNo9L,19,0,19,12,6,2,12329
211082574,2002.04679,IPBoost - Non-Convex Boosting via Integer Programming,2020,International Conference on Machine Learning,5,33,0,40,16,15,TeXGyrePagella,27,6,6,4,0,0,14214
234681538,2105.06499,Improved Algorithms for Agnostic Pool-based Active Classification,2021,International Conference on Machine Learning,18,38,0,93,379,31,NimbusRomNo9L,43,0,20,11,2,4,18033
259309473,2201.12006,Improving Expert Predictions with Conformal Prediction,2022,International Conference on Machine Learning,9,55,0,46,40,21,CMR10,26,0,17,3,0,2,12468
235826420,2107.05672,In-Database Regression in Input Sparsity Time,2021,International Conference on Machine Learning,7,54,0,13,32,0,CMR8,28,0,6,4,1,0,15393
221295701,2008.04254,Informative Dropout for Robust Representation Learning: A Shape-bias Perspective,2020,International Conference on Machine Learning,94,76,10,101,10,15,NimbusRomNo9L,18,0,6,11,5,20,11012
219558303,2006.05749,Interpolation between Residual and Non-Residual Networks,2020,International Conference on Machine Learning,10,25,0,57,52,30,NimbusRomNo9L,16,0,10,10,0,28,7947
211082853,2002.04692,Invariant Risk Minimization Games,2020,International Conference on Machine Learning,204,54,25,57,72,120,CMR10,44,0,7,18,7,8,13905
235417392,2106.06442,K-shot NAS: Learnable Weight-Sharing for NAS with K-shot Supernets,2021,International Conference on Machine Learning,24,44,2,6,6,15,NimbusRomNo9L,17,0,10,2,1,6,10649
237453499,2109.03867,LSB: Local Self-Balancing MCMC in Discrete Spaces,2021,International Conference on Machine Learning,8,34,0,54,44,62,CMR10,19,5,14,6,0,8,8369
227239286,2012.00377,Latent Programmer: Discrete Latent Codes for Program Synthesis,2020,International Conference on Machine Learning,16,55,1,0,0,0,NimbusRomNo9L,17,0,1,1,1,0,9555
215416299,2004.03991,Learning Discrete Structured Representations by Adversarially Maximizing Mutual Information,2020,International Conference on Machine Learning,7,45,1,0,0,0,NimbusRomNo9L,11,0,2,0,0,0,8323
249890440,2206.09337,Learning Multiscale Transformer Models for Sequence Generation,2022,International Conference on Machine Learning,7,61,1,90,8,24,NimbusRomNo9L,17,18,11,13,0,16,10346
219721048,2006.09607,Learning What to Defer for Maximum Independent Sets,2020,International Conference on Machine Learning,41,71,5,186,16,0,NimbusRomNo9L,16,0,9,13,0,0,9448
249890414,2206.10480,Learning to Estimate and Refine Fluid Motion with Physical Dynamics,2022,International Conference on Machine Learning,5,41,0,0,0,0,NimbusRomNo9L,16,0,0,0,0,0,8601
249712067,2206.07869,Let Invariant Rationale Discovery Inspire Graph Contrastive Learning,2022,International Conference on Machine Learning,59,45,13,111,72,16,NimbusRomNo9L,14,0,12,16,0,18,8449
221088927,2008.12946,Linear Convergence of Randomized Primal-Dual Coordinate Method for Large-scale Linear Constrained Convex Programming,2020,International Conference on Machine Learning,7,40,0,38,180,20,NimbusRomNo9L,19,0,16,9,2,0,8908
219531086,2006.04780,Lorentz Group Equivariant Neural Network for Particle Physics,2020,International Conference on Machine Learning,107,58,9,0,0,0,NimbusRomNo9L,15,0,0,0,0,0,11676
231592444,2101.05186,MC-LSTM: Mass-Conserving LSTM,2021,International Conference on Machine Learning,43,104,9,271,42,31,NimbusRomNo9L,30,31,11,11,14,40,20135
220364097,2007.02832,Maximum Entropy Gain Exploration for Long Horizon Multi-goal Reinforcement Learning,2020,International Conference on Machine Learning,100,81,11,0,0,0,NimbusRomNo9L,24,0,0,0,0,0,16067
249605440,2206.05262,Meta Optimal Transport,2022,International Conference on Machine Learning,13,106,3,170,55,72,NimbusRomNo9L,23,0,10,14,5,16,11410
250340814,2210.13664,Mitigating Gender Bias in Face Recognition using the von Mises-Fisher Mixture Model,2022,International Conference on Machine Learning,3,56,0,0,0,0,NimbusRomNo9L,26,0,1,0,0,0,12669
235624099,2106.13229,Model-Based Reinforcement Learning via Latent-Space Collocation,2021,International Conference on Machine Learning,26,69,3,0,0,0,NimbusRomNo9L,17,0,0,0,0,0,11080
220514654,2007.06680,Momentum-Based Policy Gradient Methods,2020,International Conference on Machine Learning,34,57,12,92,170,20,NimbusRomNo9L,24,0,8,16,0,4,12624
244129883,2111.08276,Multi-Grained Vision Language Pre-Training: Aligning Texts with Visual Concepts,2021,International Conference on Machine Learning,199,57,34,69,16,15,NimbusRomNo9L,16,0,7,15,0,12,9343
233392742,2105.05489,Multiscale Invertible Generative Networks for High-Dimensional Bayesian Inference,2021,International Conference on Machine Learning,2,46,0,0,0,0,NimbusRomNo9L,23,0,0,0,0,0,14965
235727277,2107.00798,Near-optimal Algorithms for Explainable k-Medians and k-Means,2021,International Conference on Machine Learning,21,29,5,0,0,0,CMR10,29,0,0,0,0,0,14178
253080761,2210.12101,Neural Network Approximations of PDEs Beyond Linearity: Representational Perspective,2022,International Conference on Machine Learning,7,40,0,79,42,0,CMR10,38,0,9,2,0,0,15745
231925196,2102.07456,Neuro-algorithmic Policies enable Fast Combinatorial Generalization,2021,International Conference on Machine Learning,12,61,1,124,21,56,NimbusRomNo9L,15,7,16,12,0,6,9742
235485505,2106.10238,Nonparametric Hamiltonian Monte Carlo,2021,International Conference on Machine Learning,5,59,1,0,0,0,NimbusRomNo9L,34,1,7,1,0,0,20484
246705846,2202.04970,Off-Policy Fitted Q-Evaluation with Differentiable Function Approximators: Z-Estimation and Inference Theory,2022,International Conference on Machine Learning,14,48,0,170,404,0,CMR10,39,17,14,19,5,2,20625
220247993,2010.11082,On Differentially Private Stochastic Convex Optimization with Heavy-tailed Data,2020,International Conference on Machine Learning,41,52,6,130,167,36,NimbusRomNo9L,16,6,13,0,0,0,10762
220302489,2007.00810,On Linear Identifiability of Learned Representations,2020,International Conference on Machine Learning,46,44,5,144,58,10,NimbusRomNo9L,18,9,13,21,1,0,9342
248811584,2205.07428,On the Convergence of the Shapley Value in Parametric Bayesian Learning Games,2022,International Conference on Machine Learning,11,26,0,8,22,3,NimbusRomNo9L,17,0,6,0,0,0,11423
