corpusid,arxiv_id,title,year,venue,citationcount,referencecount,influentialcitationcount,content_references,equations,figures,font,pages,paragraphs,sections,subsections,subsubsections,tables,words
249674673,2106.12723,Meaningfully debugging model mistakes using conceptual counterfactual explanations,2021,International Conference on Machine Learning,42,45,6,69,2,15,NimbusRomNo9L,23,4,8,14,3,2,11870
254018268,2211.13544,Meta-Learning the Inductive Bias of Simple Neural Circuits,2022,International Conference on Machine Learning,0,44,0,85,4,36,NimbusRomNo9L,14,0,11,5,0,0,8161
259108184,2207.02338,Mitigating Propagation Failures in Physics-informed Neural Networks using Retain-Resample-Release (R3) Sampling,2022,International Conference on Machine Learning,13,28,1,0,0,0,NimbusRomNo9L,39,0,0,0,0,0,19671
244953986,2112.04153,Model-Value Inconsistency as a Signal for Epistemic Uncertainty,2021,International Conference on Machine Learning,5,106,0,0,0,0,NimbusRomNo9L,25,0,0,0,0,0,14670
252907883,2210.07612,Monotonicity and Double Descent in Uncertainty Estimation with Gaussian Processes,2022,International Conference on Machine Learning,4,94,0,252,170,66,NimbusRomNo9L,33,17,13,3,0,2,16897
235417398,2106.06480,Multi-Receiver Online Bayesian Persuasion,2021,International Conference on Machine Learning,26,38,0,0,0,0,NimbusRomNo9L,22,0,1,0,0,0,16791
249889352,2206.09117,NISPA: Neuro-Inspired Stability-Plasticity Adaptation for Continual Learning in Sparse Networks,2022,International Conference on Machine Learning,26,69,3,0,0,0,NimbusRomNo9L,18,0,0,0,0,0,11182
249953820,2206.11489,Nearly Minimax Optimal Reinforcement Learning with Linear Function Approximation,2022,International Conference on Machine Learning,24,36,8,135,358,3,NimbusRomNo9L,48,28,15,22,4,4,29339
234358733,2009.08295,Neural Rough Differential Equations for Long Time Series,2020,International Conference on Machine Learning,87,40,9,0,0,0,NimbusRomNo9L,22,0,1,0,0,0,12520
231924689,2102.06780,Newton Method over Networks is Fast up to the Statistical Precision,2021,International Conference on Machine Learning,17,63,1,65,414,24,NimbusRomNo9L,31,0,14,22,0,2,18634
220042066,2006.13554,Normalized Loss Functions for Deep Learning with Noisy Labels,2020,International Conference on Machine Learning,328,39,51,64,37,22,NimbusRomNo9L,13,0,8,10,0,10,9666
221088484,2008.06700,On Efficient Low Distortion Ultrametric Embedding,2020,International Conference on Machine Learning,8,40,0,34,14,3,URWPalladioL,20,4,7,4,0,2,8194
254222854,2212.05749,On Pre-Training for Visuo-Motor Control: Revisiting a Learning-from-Scratch Baseline,2022,International Conference on Machine Learning,38,58,3,186,0,50,NimbusRomNo9L,16,1,10,7,0,10,10334
250360890,2112.09002,On the Finite-Time Complexity and Practical Computation of Approximate Stationarity Concepts of Lipschitz Functions,2021,International Conference on Machine Learning,16,59,2,157,114,8,NimbusRomNo9L,20,4,12,10,6,0,11996
235694131,2107.00649,On the Practicality of Deterministic Epistemic Uncertainty,2021,International Conference on Machine Learning,39,90,5,0,0,0,NimbusRomNo9L,40,0,7,0,0,0,19387
231728341,2101.12617,One-sided Frank-Wolfe algorithms for saddle problems,2021,International Conference on Machine Learning,4,55,0,66,129,26,CMR10,26,0,11,13,0,0,13188
249848035,2206.08802,Open-Sampling: Exploring Out-of-Distribution data for Re-balancing Long-tailed datasets,2022,International Conference on Machine Learning,17,67,3,115,24,27,NimbusRomNo9L,16,0,13,7,0,14,10744
231924424,2102.07387,Optimal Regret Algorithm for Pseudo-1d Bandit Convex Optimization,2021,International Conference on Machine Learning,5,24,0,7,66,0,URWPalladioL,25,3,3,4,0,0,10655
253080911,2210.11942,Oracles & Followers: Stackelberg Equilibria in Deep Multi-Agent Reinforcement Learning,2022,International Conference on Machine Learning,7,45,1,124,10,20,CMR10,32,19,14,6,0,6,15885
221293281,2008.10898,PAGE: A Simple and Optimal Probabilistic Gradient Estimator for Nonconvex Optimization,2020,International Conference on Machine Learning,99,56,27,142,179,24,NimbusRomNo9L,25,0,12,10,0,2,14044
234763240,2105.08164,Parallel and Flexible Sampling from Autoregressive Models via Langevin Dynamics,2021,International Conference on Machine Learning,18,62,2,17,0,9,NimbusRomNo9L,16,0,5,0,0,0,9086
249642642,2206.06597,Permutation Search of Tensor Network Structures via Local Sampling,2022,International Conference on Machine Learning,9,73,1,114,66,45,NimbusRomNo9L,19,0,9,16,0,12,12874
246411315,2201.12179,Plug & Play Attacks: Towards Robust and Flexible Model Inversion Attacks,2022,International Conference on Machine Learning,34,51,8,0,0,0,NimbusRomNo9L,24,0,0,0,0,0,15418
225102967,2010.15659,Post-selection inference with HSIC-Lasso,2020,International Conference on Machine Learning,11,54,1,167,142,6,NimbusRomNo9L,22,0,11,14,9,8,13555
231979374,2102.10058,Principled Simplicial Neural Networks for Trajectory Prediction,2021,International Conference on Machine Learning,63,37,5,107,82,11,NimbusRomNo9L,20,0,17,18,0,6,13136
222379336,2010.07904,Probabilistic Sequential Shrinking: A Best Arm Identification Algorithm for Stochastic Bandits with Corruptions,2020,International Conference on Machine Learning,10,32,1,70,154,22,CMMI10,22,0,11,13,0,4,12792
230437673,2101.01152,Provable Generalization of SGD-trained Neural Networks of Any Width in the Presence of Adversarial Label Noise,2021,International Conference on Machine Learning,13,61,1,92,93,41,SFRM1095,30,0,8,5,0,0,14281
211010722,2002.00585,Proving the Lottery Ticket Hypothesis: Pruning is All You Need,2020,International Conference on Machine Learning,227,38,27,50,89,0,NimbusRomNo9L,23,6,7,4,0,0,11671
232046330,2102.13079,Quantization Algorithms for Random Fourier Features,2021,International Conference on Machine Learning,11,72,1,46,170,104,SFRM1000,34,0,9,26,0,4,15887
211010787,2002.00937,Radioactive data: tracing through training,2020,International Conference on Machine Learning,57,47,9,1,0,0,NimbusRomNo9L,11,0,1,0,0,0,7408
253553257,2211.08944,"Reasons for the Superiority of Stochastic Estimators over Deterministic Ones: Robustness, Consistency and Perceptual Quality",2022,International Conference on Machine Learning,5,65,0,79,50,44,NimbusRomNo9L,21,0,15,10,7,8,12588
222310686,2010.06250,Regret minimization in stochastic non-convex learning via a proximal-gradient approach,2020,International Conference on Machine Learning,16,39,4,63,162,0,SFRM0700,23,5,11,9,1,0,11372
231879551,2102.05815,Representation Matters: Offline Pretraining for Sequential Decision Making,2021,International Conference on Machine Learning,104,57,7,0,3,0,CMR10,20,0,1,0,0,0,8581
220250272,2006.15820,Retro*: Learning Retrosynthetic Planning with Neural Guided A* Search,2020,International Conference on Machine Learning,74,30,21,29,20,13,NimbusRomNo9L,15,0,6,12,2,2,9439
247779106,2203.15516,Rich Feature Construction for the Optimization-Generalization Dilemma,2022,International Conference on Machine Learning,27,36,2,0,0,0,NimbusRomNo9L,15,0,0,0,0,0,9544
249395196,2206.01944,Robust Meta-learning with Sampling Noise and Label Noise via Eigen-Reptile,2022,International Conference on Machine Learning,4,62,1,71,114,24,NimbusRomNo9L,17,0,15,7,0,8,10928
220514670,2007.06661,Robustness to Spurious Correlations via Human Annotations,2020,International Conference on Machine Learning,72,53,4,0,0,0,NimbusRomNo9L,16,0,10,0,0,0,9873
235430788,2107.08273,STRODE: Stochastic Boundary Ordinary Differential Equation,2021,International Conference on Machine Learning,4,32,0,1,32,6,NimbusRomNo9L,15,0,3,3,0,0,8307
235694272,2107.00228,Scalable Certified Segmentation via Randomized Smoothing,2021,International Conference on Machine Learning,30,72,7,0,0,0,NimbusRomNo9L,19,0,0,0,0,0,12111
235196083,2105.12245,Scaling Properties of Deep Residual Networks,2021,International Conference on Machine Learning,13,34,3,0,0,0,NimbusRomNo9L,20,0,0,0,0,0,12417
235358494,2106.02990,Self-Damaging Contrastive Learning,2021,International Conference on Machine Learning,57,61,10,0,0,0,NimbusRomNo9L,13,0,0,0,0,0,8489
254366283,2212.03463,Sequential Predictive Conformal Inference for Time Series,2022,International Conference on Machine Learning,10,38,1,128,92,30,NimbusRomNo9L,21,0,10,13,2,10,12601
219980562,2006.13202,Simple and Effective VAE Training with Calibrated Decoders,2020,International Conference on Machine Learning,71,69,8,0,0,0,NimbusRomNo9L,16,0,0,0,0,0,9460
235431884,2007.00674,Sliced Iterative Normalizing Flows,2020,International Conference on Machine Learning,32,79,5,156,64,58,NimbusRomNo9L,19,0,12,14,0,16,12593
226282063,2011.04019,Sparse Feature Selection Makes Batch Reinforcement Learning More Sample Efficient,2020,International Conference on Machine Learning,25,69,0,113,472,4,NimbusRomNo9L,44,7,15,24,2,0,17745
250265109,2207.00986,Stabilizing Off-Policy Deep Reinforcement Learning from Pixels,2022,International Conference on Machine Learning,22,78,8,0,0,0,NimbusRomNo9L,27,0,1,0,0,0,15747
220403670,2007.04202,Stochastic Hamiltonian Gradient Methods for Smooth Games,2020,International Conference on Machine Learning,44,76,1,222,132,24,NimbusRomNo9L,31,10,16,31,9,8,17442
253116551,2210.14315,Streaming Submodular Maximization with Differential Privacy,2022,International Conference on Machine Learning,1,37,0,0,2,0,SFRM1000,26,0,0,0,0,0,12978
211296372,2002.10614,Subspace Fitting Meets Regression: The Effects of Supervision and Orthonormality Constraints on Double Descent of Generalization Errors,2020,International Conference on Machine Learning,13,24,1,20,102,51,NimbusRomNo9L,22,0,12,21,0,0,14358
252762611,2210.03403,TAN without a burn: Scaling Laws of DP-SGD,2022,International Conference on Machine Learning,27,57,6,101,20,13,NimbusRomNo9L,13,14,4,11,0,10,8518
219708763,2006.08600,Temporal Phenotyping using Deep Predictive Clustering of Disease Progression,2020,International Conference on Machine Learning,45,28,6,105,34,30,NimbusRomNo9L,19,0,13,13,3,12,11267
188599377,2006.05842,The Emergence of Individuality,2020,International Conference on Machine Learning,21,40,1,44,32,59,NimbusRomNo9L,11,0,8,8,0,2,7683
231984612,2102.06385,The Symmetry between Arms and Knapsacks: A Primal-Dual Approach for Bandits with Knapsacks,2021,International Conference on Machine Learning,15,25,3,72,196,0,CMMI10,39,8,11,18,0,0,17138
231934164,2102.08314,Tighter Bounds on the Log Marginal Likelihood of Gaussian Process Regression Using Conjugate Gradients,2021,International Conference on Machine Learning,12,31,3,104,50,33,NimbusRomNo9L,17,3,8,16,1,2,9039
235485289,2106.10110,Towards Distraction-Robust Active Visual Tracking,2021,International Conference on Machine Learning,25,47,2,58,6,67,NimbusRomNo9L,16,0,13,22,0,12,10925
250311297,2207.02542,Tractable Dendritic RNNs for Reconstructing Nonlinear Dynamical Systems,2022,International Conference on Machine Learning,16,87,1,0,0,0,NimbusRomNo9L,29,0,2,0,0,0,16864
246996751,2202.09244,Transfer and Marginalize: Explaining Away Label Noise with Privileged Information,2022,International Conference on Machine Learning,6,36,1,126,46,20,NimbusRomNo9L,19,11,15,15,5,18,10572
253098865,2210.12236,Uncertain Evidence in Probabilistic Models and Stochastic Simulators,2022,International Conference on Machine Learning,2,49,0,104,46,18,NimbusRomNo9L,14,0,10,9,0,2,9672
211296325,2002.10716,Understanding and Mitigating the Tradeoff Between Robustness and Accuracy,2020,International Conference on Machine Learning,185,39,11,0,0,0,NimbusRomNo9L,26,0,0,0,0,0,16792
248834078,2205.08078,Unraveling Attention via Convex Duality: Analysis and Interpretations of Vision Transformers,2022,International Conference on Machine Learning,25,65,0,77,432,6,NimbusRomNo9L,38,0,9,19,6,6,17280
251719353,2208.10264,Using Large Language Models to Simulate Multiple Humans and Replicate Human Subject Studies,2022,International Conference on Machine Learning,139,64,9,0,0,0,CMR10,43,0,0,0,0,0,20263
247318663,2203.04432,Variational Inference with Locally Enhanced Bounds for Hierarchical Models,2022,International Conference on Machine Learning,4,57,0,76,56,29,NimbusRomNo9L,14,14,11,10,0,0,8239
256416558,2210.03175,Weak Proxies are Sufficient and Preferable for Fairness with Missing Sensitive Attributes,2022,International Conference on Machine Learning,9,90,0,4,0,0,SFRM1095,38,0,0,0,0,0,16969
211989215,2003.01792,When deep denoising meets iterative phase retrieval,2020,International Conference on Machine Learning,14,61,2,117,92,12,NimbusRomNo9L,14,0,6,11,0,4,7203
246411689,2201.12078,You Only Cut Once: Boosting Data Augmentation with a Single Cut,2022,International Conference on Machine Learning,16,69,2,76,4,19,NimbusRomNo9L,17,1,14,16,2,0,10359
235294029,2106.00901,A Differentiable Point Process with Its Application to Spiking Neural Networks,2021,International Conference on Machine Learning,4,24,0,67,66,15,NimbusRomNo9L,14,0,12,11,6,2,10580
246411320,2201.12333,A Joint Exponential Mechanism For Differentially Private Top-k,2022,International Conference on Machine Learning,7,35,2,0,0,0,CMR10,22,0,1,0,0,0,8801
246430669,2201.13288,A Regret Minimization Approach to Multi-Agent Contro,2022,International Conference on Machine Learning,4,45,0,0,0,0,NimbusRomNo9L,13,0,0,0,0,0,9123
258762242,2205.10505,A Study on Transformer Configuration and Training Objective,2022,International Conference on Machine Learning,3,43,0,136,8,22,NimbusRomNo9L,13,0,11,6,0,12,8357
220768919,2007.12625,Accelerated Stochastic Gradient-free and Projection-free Methods,2020,International Conference on Machine Learning,15,62,1,75,210,46,NimbusRomNo9L,34,0,9,15,10,4,17276
246473368,2202.00911,Active Multi-Task Representation Learning,2022,International Conference on Machine Learning,6,19,1,0,0,0,NimbusRomNo9L,28,0,0,0,0,0,14106
225094160,2010.14563,Adversarial Dueling Bandits,2020,International Conference on Machine Learning,18,43,1,34,20,4,CMR10,25,5,5,3,0,0,11774
211252535,2002.09269,Aggregation of Multiple Knockoffs,2020,International Conference on Machine Learning,17,34,5,70,124,28,LMRoman10,35,0,10,15,0,2,11035
220250203,2006.16239,An Imitation Learning Approach for Cache Replacement,2020,International Conference on Machine Learning,64,53,8,96,12,27,NimbusRomNo9L,14,14,11,14,0,6,10567
254926706,2212.09567,Answering Complex Logical Queries on Knowledge Graphs via Query Computation Tree Optimization,2022,International Conference on Machine Learning,13,36,7,0,0,0,NimbusRomNo9L,20,0,2,0,0,0,12638
232134936,2103.03404,Attention is Not All You Need: Pure Attention Loses Rank Doubly Exponentially with Depth,2021,International Conference on Machine Learning,260,56,25,63,98,22,CMR7,22,2,8,18,0,0,9643
246411402,2201.12086,BLIP: Bootstrapping Language-Image Pre-training for Unified Vision-Language Understanding and Generation,2022,International Conference on Machine Learning,1910,60,365,0,0,0,NimbusRomNo9L,12,0,0,0,0,0,8191
234341323,2105.04332,Bayesian Optimistic Optimisation with Exponentially Decaying Regret,2021,International Conference on Machine Learning,2,35,0,132,44,21,NimbusRomNo9L,21,12,16,7,3,6,13540
231918685,2102.06695,Bias-Free Scalable Gaussian Processes via Randomized Truncations,2021,International Conference on Machine Learning,17,41,3,110,200,31,NimbusRomNo9L,19,14,14,18,0,4,13003
212717790,2003.06369,Boosting Frank-Wolfe by Chasing Gradients,2020,International Conference on Machine Learning,25,44,5,144,190,53,CharterBT,34,2,9,18,0,0,12989
249926811,2206.10860,Bregman Power k-Means for Clustering Exponential Family Data,2022,International Conference on Machine Learning,6,44,2,127,96,12,CMMI10,17,13,9,0,0,8,10058
235262740,2011.05869,CRPO: A New Approach for Safe Reinforcement Learning with Convergence Guarantee,2020,International Conference on Machine Learning,82,73,20,0,0,0,NimbusRomNo9L,36,0,1,0,0,0,19683
248218551,2204.07258,Causal Transformer for Estimating Counterfactual Outcomes,2022,International Conference on Machine Learning,49,68,5,133,96,21,NimbusRomNo9L,37,21,21,23,0,26,19267
232013417,2102.11742,Classifying high-dimensional Gaussian mixtures: Where kernel methods fail and neural networks succeed,2021,International Conference on Machine Learning,58,68,1,2,0,0,NimbusRomNo9L,26,0,1,0,0,0,16050
219980631,2006.12772,Combinatorial Pure Exploration of Dueling Bandit,2020,International Conference on Machine Learning,8,43,0,69,163,6,NimbusRomNo9L,36,13,10,20,0,0,19717
249712243,2206.08330,Compressed-VFL: Communication-Efficient Learning with Vertically Partitioned Data,2022,International Conference on Machine Learning,28,59,4,101,114,58,NimbusRomNo9L,29,4,11,9,0,12,16226
231855626,2102.04828,Consensus Control for Decentralized Deep Learning,2021,International Conference on Machine Learning,57,65,12,79,20,16,NimbusRomNo9L,24,16,7,9,0,14,15727
218630003,2005.06800,Context-aware Dynamics Model for Generalization in Model-Based Reinforcement Learning,2020,International Conference on Machine Learning,85,47,20,95,4,115,NimbusRomNo9L,23,0,14,12,0,6,11711
249921347,2112.00791,Controlling Conditional Language Models without Catastrophic Forgetting,2021,International Conference on Machine Learning,20,61,1,0,0,0,NimbusRomNo9L,30,0,5,0,0,0,16638
246430299,2201.12700,Coordinated Attacks against Contextual Bandits: Fundamental Limits and Defense Mechanisms,2022,International Conference on Machine Learning,5,48,0,7,70,5,NimbusRomNo9L,18,6,11,6,0,0,11705
249848024,2206.08883,CtrlFormer: Learning Transferable State Representation for Visual Control via Transformer,2022,International Conference on Machine Learning,6,63,2,0,0,0,NimbusRomNo9L,19,0,0,0,0,0,11790
253734939,2211.11501,DS-1000: A Natural and Reliable Benchmark for Data Science Code Generation,2022,International Conference on Machine Learning,119,38,23,78,0,21,NimbusRomNo9L,26,13,7,9,0,8,13481
246996693,2202.08919,Debiaser Beware: Pitfalls of Centering Regularized Transport Maps,2022,International Conference on Machine Learning,12,37,0,0,0,0,CMR10,23,0,1,0,1,0,9086
220363342,2007.02126,Deep Graph Random Process for Relational-Thinking-Based Speech Recognition,2020,International Conference on Machine Learning,16,51,2,0,52,9,NimbusRomNo9L,16,0,5,0,0,0,9406
252918507,2210.09020,Defects of Convolutional Decoder Networks in Frequency Representation,2022,International Conference on Machine Learning,7,33,0,37,282,43,NimbusRomNo9L,34,0,9,30,0,4,17362
236429082,2107.11630,Detecting Adversarial Examples Is (Nearly) As Hard As Classifying Them,2021,International Conference on Machine Learning,43,47,4,123,8,3,NimbusRomNo9L,11,1,6,7,0,4,7908
252683151,2210.00038,Differentially Private Optimization on Large Model at Small Cost,2022,International Conference on Machine Learning,22,61,1,61,12,33,NimbusRomNo9L,28,3,5,10,0,10,13770
250340907,2211.15339,Discovering Generalizable Spatial Goal Representations via Graph-based Active Reward Learning,2022,International Conference on Machine Learning,5,48,0,43,22,33,NimbusRomNo9L,16,0,9,18,2,2,10916
249017641,2205.12184,Distributional Hamilton-Jacobi-Bellman Equations for Continuous-Time Reinforcement Learning,2022,International Conference on Machine Learning,5,45,0,0,0,0,NimbusRomNo9L,25,0,1,0,0,0,13607
249712048,2206.07912,Double Sampling Randomized Smoothing,2022,International Conference on Machine Learning,13,66,1,0,0,0,NimbusRomNo9L,47,0,0,0,0,0,34350
235631883,2109.07719,Efficient Differentiable Simulation of Articulated Bodies,2021,International Conference on Machine Learning,40,77,2,0,0,0,NimbusRomNo9L,20,0,0,0,0,0,13026
247996873,2204.02610,Efficient Test-Time Model Adaptation without Forgetting,2022,International Conference on Machine Learning,146,59,48,73,18,29,NimbusRomNo9L,17,0,11,8,0,24,11508
235367984,2106.04435,Enhancing Robustness of Neural Networks through Fourier Stabilization,2021,International Conference on Machine Learning,11,32,0,38,44,15,NimbusRomNo9L,16,4,7,6,0,0,10445
256827254,2209.13555,Escaping saddle points in zeroth-order optimization: the power of two-point estimators,2022,International Conference on Machine Learning,2,63,0,173,568,7,NimbusRomNo9L,62,3,12,10,0,2,30988
246294831,2201.11413,Exact Optimal Accelerated Complexity for Fixed-Point Iterations,2022,International Conference on Machine Learning,16,108,2,145,256,40,NimbusRomNo9L,38,9,14,23,0,0,18978
233004620,2104.00995,Exponential Reduction in Sample Complexity with Learning of Ising Model Dynamics,2021,International Conference on Machine Learning,3,61,0,58,20,16,NimbusRomNo9L,29,2,7,7,0,2,16147
249097883,2205.13316,Fair Representation Learning through Implicit Path Alignment,2022,International Conference on Machine Learning,19,49,4,104,93,29,NimbusRomNo9L,20,21,16,15,0,10,12000
246430918,2201.12857,Fast Relative Entropy Coding with A* coding,2022,International Conference on Machine Learning,22,41,2,141,324,11,NimbusRomNo9L,30,2,15,3,0,4,16196
249625538,2206.05391,Feature Selection using e-values,2022,International Conference on Machine Learning,1,65,0,0,0,0,NimbusRomNo9L,21,0,1,0,0,0,12975
220525597,2007.07682,FetchSGD: Communication-Efficient Federated Learning with Sketching,2020,International Conference on Machine Learning,283,84,17,154,54,56,NimbusRomNo9L,29,3,11,16,0,2,16952
244920798,2112.03432,First-Order Regret in Reinforcement Learning with Linear Function Approximation: A Robust Estimation Approach,2021,International Conference on Machine Learning,28,64,2,0,0,0,CMR10,61,0,0,0,0,0,25148
212644664,2003.04560,Frequency Bias in Neural Networks for Input of Non-Uniform Density,2020,International Conference on Machine Learning,122,26,8,0,0,0,NimbusRomNo9L,25,0,0,0,0,0,14234
249712103,2206.08220,Functional Output Regression with Infimal Convolution: Exploring the Huber and -insensitive Losses,2022,International Conference on Machine Learning,2,38,0,96,143,34,NimbusRomNo9L,24,14,10,21,3,10,13551
235421747,2103.00123,GRAD-MATCH: Gradient Matching based Data Subset Selection for Efficient Deep Model Training,2021,International Conference on Machine Learning,113,41,21,65,388,32,NimbusRomNo9L,33,6,10,17,3,16,18779
211126885,2002.06157,Generalization and Representational Limits of Graph Neural Networks,2020,International Conference on Machine Learning,250,58,26,176,82,20,CMR10,22,9,6,3,0,2,11874
233231366,2104.06643,Generative Causal Explanations for Graph Neural Networks,2021,International Conference on Machine Learning,113,35,17,0,0,0,NimbusRomNo9L,14,0,0,0,0,0,9806
218674252,2005.08140,Global inducing point variational posteriors for Bayesian neural networks and deep Gaussian processes,2020,International Conference on Machine Learning,56,79,4,185,132,29,NimbusRomNo9L,33,8,21,12,0,20,18024
220128101,2006.14744,Graph Optimal Transport for Cross-Domain Alignment,2020,International Conference on Machine Learning,115,68,18,126,16,12,NimbusRomNo9L,12,11,6,7,0,18,7922
211532730,2002.12336,Hallucinative Topological Memory for Zero-Shot Visual Planning,2020,International Conference on Machine Learning,40,38,2,0,0,0,NimbusRomNo9L,12,0,6,0,0,0,7951
250492223,2207.06272,Hindsight Learning for MDPs with Exogenous Inputs,2022,International Conference on Machine Learning,12,114,2,268,77,31,CMR10,52,4,15,22,17,20,26057
211146623,2002.07682,How to Solve Fair k-Center in Massive Data Models,2020,International Conference on Machine Learning,34,24,5,23,0,10,LinLibertineT,19,2,7,6,0,2,10261
246485360,2202.01288,Imitation Learning by Estimating Expertise of Demonstrators,2022,International Conference on Machine Learning,32,52,5,49,39,15,NimbusRomNo9L,17,0,11,13,0,26,11446
227247944,2012.01316,Improved Contrastive Divergence Training of Energy Based Models,2020,International Conference on Machine Learning,104,75,19,128,18,0,NimbusRomNo9L,16,0,5,9,0,0,8859
231985613,2102.11086,Improving Lossless Compression Rates via Monte Carlo Bits-Back Coding,2021,International Conference on Machine Learning,21,67,1,176,100,59,NimbusRomNo9L,32,28,10,21,0,20,19356
219792001,2006.10288,Individual Calibration with Randomized Forecasting,2020,International Conference on Machine Learning,53,42,6,98,82,25,NimbusRomNo9L,19,7,10,21,5,2,11047
221081368,2010.02772,InstaHide: Instance-hiding Schemes for Private Distributed Learning,2020,International Conference on Machine Learning,123,81,25,0,0,0,CMR10,36,0,2,0,0,0,15671
232076098,2103.00895,Interpretable Stein Goodness-of-fit Tests on Riemannian Manifold,2021,International Conference on Machine Learning,7,72,1,96,83,20,LMRoman10,29,11,12,19,0,2,9943
246430262,2201.12498,Investigating Why Contrastive Learning Benefits Robustness Against Label Noise,2022,International Conference on Machine Learning,30,52,2,0,0,0,NimbusRomNo9L,21,0,1,0,0,0,13131
221135902,2008.06220,Kernel Methods for Cooperative Multi-Agent Contextual Bandits,2020,International Conference on Machine Learning,27,60,1,103,88,3,NimbusRomNo9L,19,0,12,7,0,0,12473
239024407,2110.09599,Label-Descriptive Patterns and their Application to Characterizing Classification Errors,2021,International Conference on Machine Learning,4,63,0,60,15,8,NimbusRomNo9L,17,0,9,15,0,2,12491
219721082,2006.09670,LazyIter: A Fast Algorithm for Counting Markov Equivalent DAGs and Designing Experiments,2020,International Conference on Machine Learning,10,19,0,63,20,4,NimbusRomNo9L,11,0,8,9,0,0,7786
221081510,2008.07773,Learning Fair Policies in Multiobjective (Deep) Reinforcement Learning with Average and Discounted Rewards,2020,International Conference on Machine Learning,59,39,3,88,45,68,NimbusRomNo9L,21,10,12,10,0,6,11972
220496138,2007.06477,Learning Reasoning Strategies in End-to-End Differentiable Proving,2020,International Conference on Machine Learning,79,59,10,140,20,6,NimbusRomNo9L,12,24,7,4,0,0,9088
235826418,2107.08248,Learning de-identified representations of prosody from raw audio,2021,International Conference on Machine Learning,11,60,0,0,0,0,NimbusRomNo9L,12,0,0,0,0,0,7700
260927486,2202.01108,Learning to Initiate and Reason in Event-Driven Cascading Processes,2022,International Conference on Machine Learning,0,53,0,106,64,24,NimbusRomNo9L,26,3,19,21,0,10,16510
