corpusid,arxiv_id,title,year,venue,citationcount,referencecount,influentialcitationcount,content_references,equations,figures,font,pages,paragraphs,sections,subsections,subsubsections,tables,words
249431775,2206.03230,Shedding a PAC-Bayesian Light on Adaptive Sliced-Wasserstein Distances,2022,International Conference on Machine Learning,6,74,1,124,30,16,NimbusRomNo9L,23,0,6,6,0,6,15053
235825875,2107.07889,Single Pass Entrywise-Transformed Low Rank Approximation,2021,International Conference on Machine Learning,2,16,0,0,0,0,CMMI10,23,0,1,0,0,0,10970
220249801,2006.16038,SoftSort: A Continuous Relaxation for the argsort Operator,2020,International Conference on Machine Learning,41,16,8,60,28,14,NimbusRomNo9L,18,0,7,11,0,6,11358
219179319,2006.01719,Spectral Frank-Wolfe Algorithm: Strict Complementarity and Linear Convergence,2020,International Conference on Machine Learning,14,28,5,12,0,3,NimbusRomNo9L,23,0,5,11,4,2,11865
246411711,2106.13863,Steerable 3D Spherical Neurons,2021,International Conference on Machine Learning,3,36,0,126,49,23,NimbusRomNo9L,10,2,7,13,0,4,7503
235421952,2106.07207,Straight to the Gradient: Learning to Use Novel Tokens for Neural Text Generation,2021,International Conference on Machine Learning,22,43,2,2,0,0,NimbusRomNo9L,23,0,6,0,0,0,14083
235187166,2105.11646,Structured Convolutional Kernel Networks for Airline Crew Scheduling,2021,International Conference on Machine Learning,8,49,0,206,46,18,NimbusRomNo9L,22,7,12,15,5,18,15644
235377110,2106.04941,Symmetric Spaces for Graph Embeddings: A Finsler-Riemannian Approach,2021,International Conference on Machine Learning,20,61,3,56,6,20,NimbusRomNo9L,28,0,9,2,0,10,19009
212628682,2003.03284,TaskNorm: Rethinking Batch Normalization for Meta-Learning,2020,International Conference on Machine Learning,82,42,8,94,14,10,NimbusRomNo9L,17,9,7,10,0,2,11399
235293857,2106.01070,Testing Group Fairness via Optimal Transport Projections,2021,International Conference on Machine Learning,23,43,1,92,236,9,NimbusRomNo9L,24,0,9,14,0,8,12890
248496278,2205.00639,The Multivariate Community Hawkes Model for Dependent Relational Events in Continuous-time Networks,2022,International Conference on Machine Learning,3,59,0,0,0,0,NimbusRomNo9L,18,0,1,0,0,0,11336
235421630,2106.06981,Thinking Like Transformers,2021,International Conference on Machine Learning,60,43,9,0,0,0,NimbusRomNo9L,22,0,0,0,0,0,13183
250243590,2102.03214,Topology-Aware Network Pruning using Multi-stage Graph Embedding and Reinforcement Learning,2021,International Conference on Machine Learning,26,61,2,0,0,0,NimbusRomNo9L,12,0,0,0,0,0,8069
246430965,2201.13415,Towards Scaling Difference Target Propagation by Learning Backprop Targets,2022,International Conference on Machine Learning,18,30,5,53,80,15,NimbusRomNo9L,18,18,10,10,0,18,8906
211258601,2002.09611,Tuning-free Plug-and-Play Proximal Algorithm for Inverse Imaging Problems,2020,International Conference on Machine Learning,87,103,6,188,20,53,NimbusRomNo9L,12,0,6,6,0,8,8542
248228036,2204.08200,"Understanding Gradual Domain Adaptation: Improved Analysis, Optimal Path and Beyond",2022,International Conference on Machine Learning,25,78,3,94,38,9,NimbusRomNo9L,18,2,4,5,1,0,11166
249712134,2206.08362,Unified Fourier-based Kernel and Nonlinearity Design for Equivariant Networks on Homogeneous Spaces,2022,International Conference on Machine Learning,13,54,0,122,56,6,NimbusRomNo9L,19,4,9,22,0,2,11973
235825504,2112.04014,Unsupervised Representation Learning via Neural Activation Coding,2021,International Conference on Machine Learning,7,44,0,158,34,12,NimbusRomNo9L,10,0,6,11,0,12,7071
234482582,2105.06126,Value-at-Risk Optimization with Gaussian Processes,2021,International Conference on Machine Learning,24,25,1,73,88,27,NimbusRomNo9L,14,0,14,9,0,0,10524
225076055,2010.13880,Versatile Verification of Tree Ensembles,2020,International Conference on Machine Learning,9,36,0,0,8,2,CMR5,12,1,2,5,1,4,9113
235795288,2012.05780,What Makes for End-to-End Object Detection?,2020,International Conference on Machine Learning,64,48,4,70,54,30,NimbusRomNo9L,15,0,12,11,0,8,9095
257078957,2205.11672,Why does Throwing Away Data Improve Worst-Group Error?,2022,International Conference on Machine Learning,5,26,0,51,417,27,LinLibertineT,50,16,11,12,0,2,23135
244117779,2111.07337,p-Laplacian Based Graph Neural Networks,2021,International Conference on Machine Learning,31,83,4,0,0,0,CMMI9,40,0,0,0,0,0,21002
246473302,2202.00998,3PC: Three Point Compressors for Communication-Efficient Distributed Training and a Better Theory for Lazy Aggregation,2022,International Conference on Machine Learning,26,39,1,118,274,78,NimbusRomNo9L,52,8,11,37,0,12,28340
211572587,2002.12406,A Free-Energy Principle for Representation Learning,2020,International Conference on Machine Learning,8,51,1,88,27,26,NimbusRomNo9L,24,1,14,13,0,0,9819
235390709,2106.05566,A Neural Tangent Kernel Perspective of GANs,2021,International Conference on Machine Learning,21,120,6,297,344,28,NimbusRomNo9L,45,27,12,27,10,6,26349
220280250,2007.00144,A Sequential Self Teaching Approach for Improving Generalization in Sound Event Recognition,2020,International Conference on Machine Learning,32,48,2,58,44,19,NimbusRomNo9L,14,7,10,7,3,16,10186
235485109,2106.09914,A Unified Generative Adversarial Network Training via Self-Labeling and Self-Attention,2021,International Conference on Machine Learning,3,34,0,49,18,30,NimbusRomNo9L,11,0,5,3,0,16,7068
235825462,2108.13956,APS: Active Pretraining with Successor Features,2021,International Conference on Machine Learning,86,65,17,164,36,16,NimbusRomNo9L,15,3,8,6,0,6,8921
235795331,2107.04649,Accuracy on the Line: on the Strong Correlation Between Out-of-Distribution and In-Distribution Generalization,2021,International Conference on Machine Learning,202,123,22,0,0,1,SFRM1095,80,0,0,0,0,0,32112
235694693,2107.00254,AdaXpert: Adapting Neural Architecture for Growing Data,2021,International Conference on Machine Learning,10,64,1,12,4,20,NimbusRomNo9L,16,0,5,0,0,2,10689
256416567,2210.01891,Adaptively Weighted Data Augmentation Consistency Regularization for Robust Optimization under Concept Shift,2022,International Conference on Machine Learning,0,57,0,0,0,0,NimbusRomNo9L,29,1,0,0,0,0,12124
249642197,2206.06737,Adversarial Vulnerability of Randomized Ensembles,2022,International Conference on Machine Learning,5,48,3,74,186,41,NimbusRomNo9L,28,0,12,24,3,10,14532
235129599,2106.12705,Alternative Microfoundations for Strategic Classification,2021,International Conference on Machine Learning,37,48,3,106,104,13,Kp,41,5,15,34,5,0,21486
250072970,2206.12848,Analysis of Stochastic Processes through Replay Buffers,2022,International Conference on Machine Learning,4,41,1,0,0,0,NimbusRomNo9L,22,0,1,0,0,0,12202
246867098,2202.07757,Architecture Agnostic Federated Learning for Neural Networks,2022,International Conference on Machine Learning,25,45,3,0,12,0,NimbusRomNo9L,11,0,6,0,0,0,7631
235247921,2105.13695,AutoSampling: Search for Effective Data Sampling Schedules,2021,International Conference on Machine Learning,5,33,0,73,20,12,NimbusRomNo9L,11,0,6,10,0,10,6832
233296003,2104.09460,Bayesian Algorithm Execution: Estimating Computable Properties of Black-box Functions Using Mutual Information,2021,International Conference on Machine Learning,21,59,5,0,0,0,CMCSC10,29,0,0,0,0,0,13460
249538236,2206.04569,Benefits of Overparameterized Convolutional Residual Networks: Function Approximation under Smoothness Constraint,2022,International Conference on Machine Learning,8,69,0,106,336,18,Kp,41,5,16,14,0,2,17172
248405793,2204.13060,Bisimulation Makes Analogies in Goal-Conditioned Reinforcement Learning,2022,International Conference on Machine Learning,16,59,0,104,42,49,NimbusRomNo9L,20,1,15,13,2,8,11830
250334479,2207.02971,Branchformer: Parallel MLP-Attention Architectures to Capture Local and Global Context for Speech Recognition and Understanding,2022,International Conference on Machine Learning,73,49,7,92,20,24,NimbusRomNo9L,17,0,13,14,6,24,9538
231924560,2102.07108,CATE: Computation-aware Neural Architecture Encoding with Transformers,2021,International Conference on Machine Learning,18,87,6,0,0,0,NimbusRomNo9L,14,0,0,0,0,0,9564
250340803,2207.05302,Causal Conceptions of Fairness and their Consequences,2022,International Conference on Machine Learning,36,73,2,111,538,5,NimbusRomNo9L,40,6,13,14,4,0,31039
211677676,2003.00214,Channel Equilibrium Networks for Learning Deep Representation,2020,International Conference on Machine Learning,15,48,3,183,86,58,NimbusRomNo9L,19,0,14,9,0,20,12797
234762819,2105.08692,Coach-Player Multi-Agent Reinforcement Learning for Dynamic Team Composition,2021,International Conference on Machine Learning,26,43,4,0,0,0,NimbusRomNo9L,13,0,0,0,0,0,8727
258352187,2205.14714,Comparison of meta-learners for estimating multi-valued treatment heterogeneous effects,2022,International Conference on Machine Learning,2,66,0,133,409,17,NimbusRomNo9L,42,7,14,30,11,50,19441
220403467,2007.03795,Conditional gradient methods for stochastically constrained convex minimization,2020,International Conference on Machine Learning,3,53,1,0,0,0,NimbusRomNo9L,32,0,1,0,0,0,14737
245537319,2112.14232,Constrained Gradient Descent: A Powerful and Principled Evasion Attack Against Neural Networks,2021,International Conference on Machine Learning,2,69,0,0,0,0,NimbusRomNo9L,26,0,1,0,0,0,15827
231855323,2102.04764,Continuous-Time Model-Based Reinforcement Learning,2021,International Conference on Machine Learning,36,68,7,0,0,0,NimbusRomNo9L,15,0,0,0,0,0,9052
221081816,2009.07801,Convex Calibrated Surrogates for the Multi-Label F-Measure,2020,International Conference on Machine Learning,15,27,0,94,64,3,NimbusRomNo9L,11,0,10,4,0,4,8082
231786353,2102.02193,"CountSketches, Feature Hashing and the Median of Three",2021,International Conference on Machine Learning,7,22,0,26,36,42,CMR10,14,8,5,5,0,2,8047
235421605,2002.00526,DANCE: Enhancing saliency maps using decoys,2020,International Conference on Machine Learning,10,61,1,100,28,12,NimbusRomNo9L,10,0,6,9,2,0,7394
235125689,2105.10056,Data-Free Knowledge Distillation for Heterogeneous Federated Learning,2021,International Conference on Machine Learning,378,57,57,67,62,89,NimbusRomNo9L,20,0,9,19,0,12,11856
232134951,2103.03868,Decomposable Submodular Function Minimization via Maximum Flow,2021,International Conference on Machine Learning,6,64,2,78,196,0,SFRM1095,41,6,10,14,0,0,19030
250341050,2207.04684,Deep Squared Euclidean Approximation to the Levenshtein Distance for DNA Storage,2022,International Conference on Machine Learning,2,42,1,39,63,16,NimbusRomNo9L,14,0,10,5,0,2,10330
231924624,2102.07655,Dense for the Price of Sparse: Improved Performance of Sparsely Initialized Networks via a Subspace Offset,2021,International Conference on Machine Learning,9,27,1,43,6,15,NimbusRomNo9L,18,0,8,7,0,2,9813
249674685,2206.07290,Differentiable Top-k Classification Learning,2022,International Conference on Machine Learning,16,43,1,161,11,16,NimbusRomNo9L,13,1,8,16,0,14,10154
235376755,2106.04800,Diffusion Source Identification on Networks with Statistical Confidence,2021,International Conference on Machine Learning,8,31,0,57,40,6,NimbusRomNo9L,21,0,12,11,0,8,9173
258999663,2108.11684,Disentangled Generative Models for Robust Prediction of System Dynamics,2021,International Conference on Machine Learning,4,46,0,111,22,91,NimbusRomNo9L,27,0,16,28,0,22,13155
231839425,2102.02887,Do We Actually Need Dense Over-Parameterization? In-Time Over-Parameterization in Sparse Training,2021,International Conference on Machine Learning,97,74,20,127,0,30,NimbusRomNo9L,16,0,13,12,2,10,10852
246411494,2201.12083,DynaMixer: A Vision MLP Architecture with Dynamic Mixing,2022,International Conference on Machine Learning,33,58,5,119,10,9,NimbusRomNo9L,11,14,5,11,0,18,8163
231951562,2102.09127,Efficient Online ML API Selection for Multi-Label Classification Tasks,2021,International Conference on Machine Learning,10,63,2,0,0,0,NimbusRomNo9L,31,0,0,0,0,0,17416
235826319,2107.06996,Elastic Graph Neural Networks,2021,International Conference on Machine Learning,87,50,16,6,2,0,NimbusRomNo9L,13,0,3,0,0,4,8296
247839510,2203.17003,Equivariant Diffusion for Molecule Generation in 3D,2022,International Conference on Machine Learning,315,53,47,12,0,3,NimbusRomNo9L,21,0,5,11,4,2,11812
244954233,2112.04330,Estimation in Rotationally Invariant Generalized Linear Models via Approximate Message Passing,2021,International Conference on Machine Learning,23,67,3,60,221,33,CMR10,35,26,11,4,0,0,16304
235265726,2106.00154,Explanations for Monotonic Classifiers,2021,International Conference on Machine Learning,36,57,0,0,0,0,NimbusRomNo9L,10,0,0,0,0,0,8445
246430171,2201.12740,FEDformer: Frequency Enhanced Decomposed Transformer for Long-term Series Forecasting,2022,International Conference on Machine Learning,515,57,88,0,0,0,NimbusRomNo9L,19,0,0,0,0,0,13893
246485804,2202.01331,Fast Convex Optimization for Two-Layer ReLU Networks: Equivalent Model Classes and Cone Decompositions,2022,International Conference on Machine Learning,22,75,1,121,51,15,NimbusRomNo9L,47,0,8,10,2,0,24827
248392126,2204.12055,Faster Fundamental Graph Algorithms via Learned Predictions,2022,International Conference on Machine Learning,31,87,2,1,0,0,CMR10,25,0,1,0,0,0,13851
226975511,2011.08474,Federated Composite Optimization,2020,International Conference on Machine Learning,43,113,9,0,0,0,SFRM1000,49,0,0,0,0,0,23658
248810929,2205.07308,Finding Global Homophily in Graph Neural Networks When Meeting Heterophily,2022,International Conference on Machine Learning,96,33,20,56,80,33,NimbusRomNo9L,15,0,12,11,0,8,10154
235624058,2106.13058,Fold2Seq: A Joint Sequence(1D)-Fold(3D) Embedding-based Generative Model for Protein Design,2021,International Conference on Machine Learning,44,50,1,98,16,13,NimbusRomNo9L,17,13,7,6,0,6,9897
246430573,2107.07999,From block-Toeplitz matrices to differential equations on graphs: towards a general theory for scalable masked Transformers,2021,International Conference on Machine Learning,20,48,0,131,77,39,NimbusRomNo9L,22,4,9,21,9,20,14501
226307169,2011.06015,GANMEX: One-vs-One Attributions using GAN-based Model Explainability,2020,International Conference on Machine Learning,11,44,2,69,18,30,NimbusRomNo9L,18,3,13,15,0,8,10851
246867214,2202.07765,"General-purpose, long-context autoregressive modeling with Perceiver AR",2022,International Conference on Machine Learning,55,76,7,103,14,171,NimbusRomNo9L,24,0,16,25,4,26,14393
246680340,2202.04357,Generalized Strategic Classification and the Case of Aligned Incentives,2022,International Conference on Machine Learning,14,37,1,0,0,0,NimbusRomNo9L,26,0,0,0,0,0,14338
235196072,2105.12486,GeomCA: Geometric Evaluation of Data Representations,2021,International Conference on Machine Learning,11,31,0,14,0,13,NimbusRomNo9L,13,0,2,3,0,6,9345
246411592,2201.12250,Gradient Descent on Neurons and its Link to Approximate Second-Order Optimization,2022,International Conference on Machine Learning,13,78,1,154,44,66,NimbusRomNo9L,37,0,20,31,5,2,20124
231639188,2101.07393,Grounding Language to Entities and Dynamics for Generalization in Reinforcement Learning,2021,International Conference on Machine Learning,41,51,7,0,0,0,NimbusRomNo9L,17,0,0,0,0,0,11777
246473164,2202.00858,Hierarchical Shrinkage: improving the accuracy and interpretability of tree-based methods,2022,International Conference on Machine Learning,19,61,2,3,12,69,NimbusRomNo9L,22,0,5,10,0,4,11702
256390437,2008.08427,How Powerful are Shallow Neural Networks with Bandlimited Random Weights?,2020,International Conference on Machine Learning,2,78,0,50,108,27,NimbusRomNo9L,22,5,10,13,0,8,14525
211677704,2003.00802,Hypernetwork approach to generating point clouds,2020,International Conference on Machine Learning,31,37,0,83,2,22,NimbusRomNo9L,10,6,5,0,0,4,6205
250340710,2207.08942,Implicit Regularization with Polynomial Growth in Deep Tensor Factorization,2022,International Conference on Machine Learning,1,22,0,79,84,27,NimbusRomNo9L,18,6,9,7,5,2,9874
232290663,2103.10834,"Improved, Deterministic Smoothing for L1 Certified Robustness",2021,International Conference on Machine Learning,35,39,2,119,58,24,NimbusRomNo9L,23,0,7,4,2,2,12611
250360832,2207.07256,Improving Task-free Continual Learning by Distributionally Robust Memory Evolution,2022,International Conference on Machine Learning,22,39,2,14,20,0,NimbusRomNo9L,15,5,5,0,0,8,9425
220424606,2007.04915,Influence Diagram Bandits: Variational Thompson Sampling for Structured Bandit Problems,2020,International Conference on Machine Learning,2,49,0,88,85,19,NimbusRomNo9L,16,0,11,15,0,2,10497
231924976,2102.07024,Interactive Learning from Activity Description,2021,International Conference on Machine Learning,34,72,3,0,0,0,NimbusRomNo9L,26,0,1,0,0,2,16857
225103094,2010.15285,Intrinsic Sliced Wasserstein Distances for Comparing Collections of Probability Distributions on Manifolds and Graphs,2020,International Conference on Machine Learning,12,63,1,65,13,13,NimbusRomNo9L,28,7,9,6,0,4,18219
233307356,2104.09750,Joint Online Learning and Decision-making via Dual Mirror Descent,2021,International Conference on Machine Learning,8,27,1,0,1,0,CMR10,36,0,0,0,0,0,17087
211572839,2002.12462,LEEP: A New Measure to Evaluate Transferability of Learned Representations,2020,International Conference on Machine Learning,161,62,48,185,16,40,NimbusRomNo9L,14,0,8,9,0,2,9659
234767689,2011.10890,Large-Scale Multi-Agent Deep FBSDEs,2020,International Conference on Machine Learning,4,21,0,120,236,45,NimbusRomNo9L,23,0,17,27,0,6,13025
253264829,2211.01724,Learning Control by Iterative Inversion,2022,International Conference on Machine Learning,1,55,0,101,84,48,NimbusRomNo9L,28,4,10,28,6,16,13710
259088628,2201.12658,Learning Intuitive Policies Using Action Features,2022,International Conference on Machine Learning,1,40,0,79,10,21,NimbusRomNo9L,15,0,9,10,0,10,9861
248377666,2204.11371,Learning Symmetric Embeddings for Equivariant World Models,2022,International Conference on Machine Learning,29,53,0,106,26,46,NimbusRomNo9L,18,25,15,11,0,12,10626
232257740,2103.09284,Learning in Nonzero-Sum Stochastic Games with Potentials,2021,International Conference on Machine Learning,37,65,2,97,212,17,NimbusRomNo9L,33,0,12,7,2,0,18086
259095443,2211.13585,Learning to Suggest Breaks: Sustainable Optimization of Long-Term User Engagement,2022,International Conference on Machine Learning,1,58,0,0,0,0,NimbusRomNo9L,26,0,0,0,0,0,16531
252668631,2209.15097,Likelihood adjusted semidefinite programs for clustering heterogeneous data,2022,International Conference on Machine Learning,1,45,0,89,122,28,NimbusRomNo9L,21,0,7,8,3,0,13363
211678151,2003.00189,Logarithmic Regret for Adversarial Online Control,2020,International Conference on Machine Learning,60,53,8,0,0,0,CMR10,54,0,11,0,0,0,22846
259313794,2207.10553,MABe22: A Multi-Species Multi-Task Benchmark for Learned Representations of Behavior,2022,International Conference on Machine Learning,1,94,0,148,4,18,NimbusRomNo9L,56,2,14,21,14,26,32853
258887708,2209.12016,Mastering the Unsupervised Reinforcement Learning Benchmark from Pixels,2022,International Conference on Machine Learning,9,65,2,181,20,50,NimbusRomNo9L,20,11,18,8,0,2,10803
227247903,2012.01227,Message Passing Adaptive Resonance Theory for Online Active Semi-supervised Learning,2020,International Conference on Machine Learning,6,46,0,50,36,34,NimbusRomNo9L,19,1,9,14,0,24,10153
211258845,2002.09516,Minimax-Optimal Off-Policy Evaluation with Linear Function Approximation,2020,International Conference on Machine Learning,124,23,18,40,573,4,NimbusRomNo9L,42,5,14,28,4,0,20965
245424947,2112.12320,Model Selection in Batch Policy Optimization,2021,International Conference on Machine Learning,9,52,1,6,0,0,SFRM1200,45,0,7,0,0,0,16225
249953810,2206.11468,Modular Conformal Calibration,2022,International Conference on Machine Learning,11,27,2,0,0,6,NimbusRomNo9L,16,0,0,0,0,0,10153
219179780,2006.01482,Multi-Agent Determinantal Q-Learning,2020,International Conference on Machine Learning,61,41,0,91,75,32,NimbusRomNo9L,17,0,9,12,0,4,12129
220425140,2007.04876,Multinomial Logit Bandit with Low Switching Cost,2020,International Conference on Machine Learning,15,23,2,35,161,0,NimbusRomNo9L,25,18,12,8,0,0,15840
246485834,2202.01752,Near-Optimal Learning of Extensive-Form Games with Imperfect Information,2022,International Conference on Machine Learning,18,77,1,144,357,0,CMR10,50,20,15,29,4,0,22646
250360821,2207.03691,Neural Implicit Dictionary Learning via Mixture-of-Expert Training,2022,International Conference on Machine Learning,6,81,0,163,26,18,NimbusRomNo9L,12,18,7,8,0,6,8590
248965170,2205.10128,Neural-Symbolic Models for Logical Queries on Knowledge Graphs,2022,International Conference on Machine Learning,50,44,7,0,0,0,NimbusRomNo9L,25,0,0,0,0,0,16135
232146616,2103.04514,Nondeterminism and Instability in Neural Network Optimization,2021,International Conference on Machine Learning,28,40,3,42,2,12,NimbusRomNo9L,16,23,14,6,0,20,9887
235826332,2107.06615,Oblivious Sketching for Logistic Regression,2021,International Conference on Machine Learning,14,51,1,52,91,33,CMR10,32,0,13,9,0,2,13891
249097478,2205.13176,On Collective Robustness of Bagging Against Data Poisoning,2022,International Conference on Machine Learning,17,46,2,61,44,20,NimbusRomNo9L,20,2,15,18,0,24,14191
220545044,2008.04510,On Learning Language-Invariant Representations for Universal Machine Translation,2020,International Conference on Machine Learning,7,63,0,0,0,0,NimbusRomNo9L,23,0,2,0,0,0,12162
253734549,2211.11033,On the Complexity of Bayesian Generalization,2022,International Conference on Machine Learning,1,86,0,96,18,39,NimbusRomNo9L,21,19,9,18,0,2,10984
249926616,2206.10614,On the Impossibility of Learning to Cooperate with Adaptive Partner Strategies in Repeated Games,2022,International Conference on Machine Learning,1,28,0,40,98,0,NimbusRomNo9L,13,2,12,7,0,0,9590
219708275,2006.08993,On the Variational Posterior of Dirichlet Process Deep Latent Gaussian Mixture Models,2020,International Conference on Machine Learning,3,21,0,21,32,12,NimbusRomNo9L,7,0,8,7,0,2,4189
211082906,2002.04726,Online Learning with Imperfect Hints,2020,International Conference on Machine Learning,47,42,1,43,236,0,NimbusRomNo9L,17,2,7,6,0,0,11506
250360899,2207.05376,Optimal Clustering with Noisy Queries via Multi-Armed Bandit,2022,International Conference on Machine Learning,4,27,0,50,34,0,NimbusRomNo9L,17,11,11,16,0,0,12282
234338859,2105.04550,Optimization of Graph Neural Networks: Implicit Acceleration by Skip Connections and More Depth,2021,International Conference on Machine Learning,57,72,8,69,34,22,NimbusRomNo9L,40,0,7,7,0,0,19219
231942295,2102.08570,Outside the Echo Chamber: Optimizing the Performative Risk,2021,International Conference on Machine Learning,73,52,13,3,3,0,Kp,32,0,4,0,0,0,13764
246705974,2202.04713,PINs: Progressive Implicit Networks for Multi-Scale Neural Representations,2022,International Conference on Machine Learning,9,45,2,72,10,67,NimbusRomNo9L,14,3,11,12,2,4,7389
231879712,2102.06083,Partially Observed Exchangeable Modeling,2021,International Conference on Machine Learning,4,49,0,52,48,53,NimbusRomNo9L,15,0,8,12,4,2,9415
221555310,2009.04416,Phasic Policy Gradient,2020,International Conference on Machine Learning,118,22,22,48,0,30,CMR10,17,0,9,8,0,0,4388
232320312,2103.12726,Policy Information Capacity: Information-Theoretic Measure for Task Complexity in Deep Reinforcement Learning,2021,International Conference on Machine Learning,12,79,1,135,58,50,NimbusRomNo9L,33,26,21,14,3,44,20636
235417170,2106.06508,Preferential Temporal Difference Learning,2021,International Conference on Machine Learning,6,41,2,84,40,75,NimbusRomNo9L,23,0,9,8,7,2,15027
221082524,2010.12799,Private Outsourced Bayesian Optimization,2020,International Conference on Machine Learning,19,63,1,163,144,11,NimbusRomNo9L,27,0,8,10,2,24,18389
211069372,2002.03113,Projective Preferential Bayesian Optimization,2020,International Conference on Machine Learning,12,25,2,51,40,6,NimbusRomNo9L,9,0,7,8,0,2,6174
231839680,2102.03192,Provably Efficient Algorithms for Multi-Objective Competitive RL,2021,International Conference on Machine Learning,18,38,7,124,138,10,URWPalladioL,30,9,12,5,0,4,12913
249953896,2206.11844,Quant-BnB: A Scalable Branch-and-Bound Method for Optimal Decision Trees with Continuous Features,2022,International Conference on Machine Learning,9,31,1,52,208,10,CMR10,31,0,12,26,0,14,13721
249847910,2206.08627,RECAPP: Crafting a More Efficient Catalyst for Convex Optimization,2022,International Conference on Machine Learning,8,51,0,264,220,8,CMR10,38,32,14,6,0,2,18142
249192016,2205.15236,RankSim: Ranking Similarity Regularization for Deep Imbalanced Regression,2022,International Conference on Machine Learning,23,40,7,0,0,0,NimbusRomNo9L,16,0,0,0,0,0,13030
219966300,2006.11827,Refined bounds for algorithm configuration: The knife-edge of dual class approximability,2020,International Conference on Machine Learning,12,51,0,0,0,0,CMR10,29,0,7,7,0,0,14567
220128347,2006.14950,Relative Deviation Margin Bounds,2020,International Conference on Machine Learning,11,41,2,118,202,3,CMR10,34,0,15,5,0,0,12318
256504106,2210.16913,Revisiting Simple Regret: Fast Rates for Returning a Good Arm,2022,International Conference on Machine Learning,6,50,1,58,34,5,NimbusRomNo9L,49,0,5,3,0,0,25416
250311162,2207.02739,Robust Counterfactual Explanations for Tree-Based Ensembles,2022,International Conference on Machine Learning,28,30,5,44,12,13,SFRM1000,18,1,5,7,0,6,9033
233346955,2104.10740,Robust Testing and Estimation under Manipulation Attacks,2021,International Conference on Machine Learning,6,36,1,10,27,2,CMR8,18,0,4,0,0,0,7708
252815402,2210.05337,SGD with large step sizes learns sparse features,2022,International Conference on Machine Learning,39,63,2,104,48,93,NimbusRomNo9L,23,0,9,8,2,0,13877
